{
  "schemaVersion": 1,
  "datasetId": "w1-smoke",
  "version": "0.1.0",
  "description": "Synthetic W-1 Excel grounding targets; smoke-scale corpus for replay/compare tooling.",
  "cases": [
    {
      "id": "w1-name-box-100",
      "consentClass": "synthetic",
      "split": "regression",
      "taskDescription": "Name Box at 100% scaling, light theme",
      "contentSha256": "2ef80177195ecb612232174c5b81f6c328914ab8fbfc426ae2e8427f55ef2f40",
      "displayMetadata": {
        "scaling": 1.0,
        "locale": "en-US",
        "theme": "light"
      },
      "expected": {
        "kind": "region",
        "region": {
          "x": 24,
          "y": 28,
          "w": 140,
          "h": 22
        }
      }
    },
    {
      "id": "w1-sheet-tab-cjk",
      "consentClass": "synthetic",
      "split": "regression",
      "taskDescription": "Sheet tab \u5ba2\u6237\u540d\u5355 at 150% scaling, Simplified Chinese UI",
      "contentSha256": "bd3ff5711aff0d6ca0ce3f33e5187f5659d9d782805901f5215d5d34b315f9cd",
      "displayMetadata": {
        "scaling": 1.5,
        "locale": "zh-CN",
        "theme": "light"
      },
      "expected": {
        "kind": "region",
        "region": {
          "x": 460,
          "y": 1042,
          "w": 96,
          "h": 26
        }
      }
    },
    {
      "id": "w1-filter-arrow",
      "consentClass": "synthetic",
      "split": "regression",
      "taskDescription": "Filter dropdown arrow on the email header",
      "contentSha256": "04935d4420d2bde22e14be68bb13b2e2606a829680e7d36fba979f92d9b7762c",
      "displayMetadata": {
        "scaling": 1.0,
        "locale": "en-US",
        "theme": "dark"
      },
      "expected": {
        "kind": "region",
        "region": {
          "x": 512,
          "y": 190,
          "w": 18,
          "h": 18
        }
      }
    },
    {
      "id": "w1-ribbon-icon-only",
      "consentClass": "synthetic",
      "split": "regression",
      "taskDescription": "Icon-only ribbon button (Merge & Center) in a collapsed ribbon group",
      "contentSha256": "1bd9c17797fd8fdd0883d00cd4e8a7e0ed2df13428b80ef8dc2854e0812debe4",
      "displayMetadata": {
        "scaling": 1.5,
        "locale": "en-US",
        "theme": "light"
      },
      "expected": {
        "kind": "region",
        "region": {
          "x": 232,
          "y": 118,
          "w": 32,
          "h": 32
        }
      }
    },
    {
      "id": "w1-gallery-swatch",
      "consentClass": "synthetic",
      "split": "regression",
      "taskDescription": "Table style gallery swatch, second row third column",
      "contentSha256": "16aa0f91025981be4e5c98d3cebe3961ba7eccb0551664d154fce617fa82ed59",
      "displayMetadata": {
        "scaling": 1.0,
        "locale": "en-US",
        "theme": "light"
      },
      "expected": {
        "kind": "region",
        "region": {
          "x": 700,
          "y": 260,
          "w": 64,
          "h": 48
        }
      }
    },
    {
      "id": "w1-absent-collapsed-group",
      "consentClass": "synthetic",
      "split": "regression",
      "taskDescription": "Control removed by collapsing the ribbon \u2014 must not be found",
      "contentSha256": "ba3344d4fed0fcf7303d6f6dcfcf35f9a953930f82221f80e077792568f41dff",
      "displayMetadata": {
        "scaling": 1.0,
        "locale": "en-US",
        "theme": "light"
      },
      "expected": {
        "kind": "absent"
      }
    },
    {
      "id": "w1-ambiguous-repeated-label",
      "consentClass": "synthetic",
      "split": "regression",
      "taskDescription": "Repeated sheet tab labels \u2014 ambiguous target",
      "contentSha256": "338db41c4da368e12126a5cdd95fc91363786370551dd81c4fc7289aa605b7ad",
      "displayMetadata": {
        "scaling": 1.0,
        "locale": "en-US",
        "theme": "light"
      },
      "expected": {
        "kind": "ambiguous"
      }
    },
    {
      "id": "w1-header-cell-zh",
      "consentClass": "synthetic",
      "split": "regression",
      "taskDescription": "Header cell \u7535\u5b50\u90ae\u4ef6 in the Chinese workbook fixture",
      "contentSha256": "ccdeffb28b4d8e5ff07be79bc76c13d924c96fd3fec7be3360a8e899fd417a1f",
      "displayMetadata": {
        "scaling": 1.0,
        "locale": "zh-CN",
        "theme": "light"
      },
      "expected": {
        "kind": "region",
        "region": {
          "x": 64,
          "y": 188,
          "w": 120,
          "h": 24
        }
      }
    }
  ]
}
